grupo,cnpj,fundo,documentos_inventariados,pdfs_locais_analisaveis,documentos_sem_pdf_local,paginas_pdf_locais,quebra_por_categoria
Mercado Crédito,33.254.370/0001-04,MERCADO CRÉDITO FUNDO DE INVESTIMENTO EM DIREITOS CREDITÓRIOS RESPONSABILIDADE LIMITADA,75,30,45,1282,assembleia: 16; evento: 1; outro: 45; regulamento: 13
Mercado Crédito,37.511.828/0001-14,MERCADO CRÉDITO I BRASIL FIDC SEGMENTO FINANCEIRO DE RESPONSABILIDADE LIMITADA,73,39,34,1951,assembleia: 26; evento: 1; outro: 34; regulamento: 12
Mercado Crédito,41.970.012/0001-26,MERCADO CRÉDITO II BRASIL FUNDO DE INVESTIMENTO EM DIREITOS CREDITÓRIOS DE RESPONSABILIDADE LIMITADA,78,40,38,2964,assembleia: 15; emissao: 2; evento: 1; outro: 38; regulamento: 22
Mercado Crédito,28.472.333/0001-32,Mercado Crédito Merchant Fundo de Investimento em Direitos Creditórios,52,14,38,539,assembleia: 10; evento: 1; outro: 38; regulamento: 3
Sellers,63.572.282/0001-11,SELLER 3 FUNDO DE INVESTIMENTO EM DIREITOS CREDITÓRIOS SEGMENTO MEIOS DE PAGAMENTO DE RESP LIMITADA,10,10,0,488,assembleia: 3; emissao: 3; regulamento: 4
Sellers,50.473.039/0001-02,SELLER FIDC SEGMENTO MEIOS DE PAGAMENTO DE RESPONSABILIDADE LIMITADA,44,21,23,1047,assembleia: 6; emissao: 7; outro: 23; regulamento: 8
Sellers,55.471.753/0001-77,SELLER II FUNDO DE INVESTIMENTO EM DIREITOS CREDITÓRIOS SEGMENTO MEIOS DE PAGAMENTO RESP LTDA,28,13,15,491,assembleia: 3; emissao: 2; evento: 3; outro: 15; regulamento: 5
