fundo,CNPJ,Data regulamento,Critério,Evento,Comparação,Limite,Monitorável IME,Métrica IME,Fonte
TAMBASA,50.327.909/0001-27,06/10/2025,Limite de concentração,elegibilidade,<=,50%,nao_monitoravel,—,1007241_regulamento_regulamento_1007241_2025-10-06.pdf
TAMBASA,50.327.909/0001-27,06/10/2025,Critérios de elegibilidade dos direitos creditórios,elegibilidade,texto,—,nao_monitoravel,—,1007241_regulamento_regulamento_1007241_2025-10-06.pdf
TAMBASA,50.327.909/0001-27,06/10/2025,Critérios de elegibilidade dos direitos creditórios,Critérios de elegibilidade dos direitos creditórios,—,Regra textual de elegibilidade dos direitos creditórios; verificar observação e fonte.,nao_monitoravel,—,1007241_regulamento_regulamento_1007241_2025-10-06.pdf · ID 1007241 · 06/10/2025
TAMBASA,50.327.909/0001-27,06/10/2025,Hedges/derivativos permitidos,enquadramento,texto,—,parcial,Posições mantidas em derivativos,1007241_regulamento_regulamento_1007241_2025-10-06.pdf
TAMBASA,50.327.909/0001-27,06/10/2025,"Troca de administrador, gestor ou prestador-chave",evento_de_avaliação_ou_liquidação,texto,—,nao_monitoravel,—,1007241_regulamento_regulamento_1007241_2025-10-06.pdf
