fundo,cnpj,classe_serie,serie_curta,tipo,data_deliberacao,data_emissao_integralizacao,data_encerramento_oferta,quantidade_cotas,volume_brl,volume_mm,pu_emissao_brl,remuneracao,juros_remuneracao,amortizacao_principal,status_evidencia,fonte,tipo_dado
SELLER,50.473.039/0001-02,Sênior 1ª série,S1,Sênior,22/05/2023,31/05/2023,31/05/2023 (liquidação ajustada; encerramento máximo 20/11/2023),1000000.0,1000000000.0,1000.0,1000.0,"DI + 1,60% a.a. (252 d.u.)","Semestral, a cada 6 meses a partir do 6º mês até a amortização final","15/12/2025: 25,00%; 15/01/2026: 33,33%; 15/02/2026: 50,00%; 15/03/2026: 100,00%",Data de liquidação ajustada para 31/05/2023; suplemento traz calendário completo,468755 p.3; 471622 p.2; 467929 pp.115-117,Curadoria Toma Conta/regulatory_profiles
SELLER,50.473.039/0001-02,Sênior 2ª série,S2,Sênior,22/05/2023,31/05/2023,31/05/2023 (liquidação ajustada; encerramento máximo 20/11/2023),500000.0,500000000.0,500.0,1000.0,"DI + 1,80% a.a. (252 d.u.)","Semestral, a cada 6 meses a partir do 6º mês até a amortização final","15/04/2026: 50,00%; 15/05/2026: 100,00%",Data de liquidação ajustada para 31/05/2023; suplemento traz calendário completo,468755 p.3; 471622 p.2; 467929 pp.118-120,Curadoria Toma Conta/regulatory_profiles
SELLER,50.473.039/0001-02,Sênior 3ª série,S3,Sênior,23/11/2023,,Anúncio de início 27/11/2023; encerramento máximo 24/05/2024,200000.0,200000000.0,200.0,1000.0,Não identificada nos PDFs baixados,Não identificado,Não identificado,Ata aprova emissão e remete a suplemento; suplemento com calendário específico não apareceu no texto extraído dos documentos baixados,558803 pp.4-5; 559856 pp.1-2,Curadoria Toma Conta/regulatory_profiles
SELLER,50.473.039/0001-02,Sênior 4ª série,S4,Sênior,23/11/2023,,Anúncio de início 27/11/2023; encerramento máximo 24/05/2024,100000.0,100000000.0,100.0,1000.0,Não identificada nos PDFs baixados,Não identificado,Não identificado,Ata aprova emissão e remete a suplemento; suplemento com calendário específico não apareceu no texto extraído dos documentos baixados,558803 pp.4-5; 559856 pp.1-2,Curadoria Toma Conta/regulatory_profiles
SELLER,50.473.039/0001-02,Subordinada Júnior (emissão 2023),Sub Jr 2023,Subordinada Júnior,23/11/2023,,Colocação privada,,200000000.0,200.0,,Residual / sem parâmetro definido,Sem calendário fixo identificado,Pode ser extraordinária se respeitado o índice de subordinação e caixa excedente; sem calendário fixo,Aprovada em assembleia como colocação privada,558803 p.4,Curadoria Toma Conta/regulatory_profiles
SELLER,50.473.039/0001-02,Sênior 5ª série,S5,Sênior,19/05/2025 e 26/05/2025,29/05/2025,04/06/2025,1500000.0,1500000000.0,1500.0,1000.0,"DI + 0,85% a.a. (252 d.u.)","Semestral, a cada 6 meses a partir do 6º mês até a amortização final","15/12/2027: 16,67%; 15/01/2028: 20,00%; 15/02/2028: 25,00%; 15/03/2028: 33,33%; 15/04/2028: 50,00%; 15/05/2028: 100,00%",Oferta integralmente subscrita por 2 instituições financeiras ligadas,909546 p.9; 912093 pp.3-5; 912172 p.2; 932137 p.2,Curadoria Toma Conta/regulatory_profiles
